{
  "policyKind": "state_rules",
  "version": 1,
  "effectiveFrom": "1970-01-01T00:00:00Z",
  "effectiveTo": null,
  "scope": { "tenantId": "00000000-0000-0000-0000-000000000000", "siteId": null, "unitId": null },
  "notes": "Seed default recorded 2026-10-07: spec DT02 defaults (5 s debounce, 60 s micro-stop, 10 s restart confirmation, staleness max(60 s, 3 x sample interval)), states outside schedule detected, no occurrence bridging. microStopSeconds must stay equal to oee_policy.body.microStopSeconds. scope.tenantId is a placeholder that the seeder replaces.",
  "body": {
    "debounceSeconds": 5,
    "microStopSeconds": 60,
    "restartConfirmSeconds": 10,
    "staleSeconds": 60,
    "staleSampleFactor": 3,
    "monitorOutsideSchedule": true,
    "gapPolicyMaxGapSeconds": 0
  }
}
